{
  "schema_version": "1.0",
  "workflow_id": "b7ef8394",
  "workflow_name": "plan1-test",
  "status": "completed",
  "started_at": "2026-01-10T11:42:53.693183+00:00",
  "completed_at": "2026-01-10T11:42:53.696922+00:00",
  "current_step": null,
  "completed_steps": [],
  "pending_steps": [
    "analyze",
    "confirm"
  ],
  "running_steps": [],
  "parallel_branches": [],
  "errors": [],
  "variables": {
    "task_description": "Test task"
  },
  "step_outputs": {}
}